21:36:11.549171 IP tele.event.dreamhack.se.2022 > 77-80-229-87.event.dreamhack.se.64241: Flags [P.], seq 747561563:747561671, ack 3086564365, win 345, options [nop,nop,TS val 3858040 ecr 754710865], length 108
21:36:11.549253 IP tele.event.dreamhack.se.2022 > 77-80-229-87.event.dreamhack.se.64241: Flags [P.], seq 108:144, ack 1, win 345, options [nop,nop,TS val 3858040 ecr 754710865], length 36
21:36:11.549274 IP tele.event.dreamhack.se.2022 > 77-80-229-87.event.dreamhack.se.64241: Flags [P.], seq 144:252, ack 1, win 345, options [nop,nop,TS val 3858040 ecr 754710865], length 108
21:36:11.549298 IP tele.event.dreamhack.se.2022 > 77-80-229-87.event.dreamhack.se.64241: Flags [P.], seq 252:288, ack 1, win 345, options [nop,nop,TS val 3858040 ecr 754710865], length 36
21:36:11.549615 IP 77-80-229-87.event.dreamhack.se.64241 > tele.event.dreamhack.se.2022: Flags [.], ack 108, win 4092, options [nop,nop,TS val 754710933 ecr 3858040], length 0
21:36:11.549637 IP 77-80-229-87.event.dreamhack.se.64241 > tele.event.dreamhack.se.2022: Flags [.], ack 144, win 4091, options [nop,nop,TS val 754710933 ecr 3858040], length 0
21:36:11.549662 IP 77-80-229-87.event.dreamhack.se.64241 > tele.event.dreamhack.se.2022: Flags [.], ack 252, win 4088, options [nop,nop,TS val 754710933 ecr 3858040], length 0
21:36:11.549668 IP 77-80-229-87.event.dreamhack.se.64241 > tele.event.dreamhack.se.2022: Flags [.], ack 288, win 4087, options [nop,nop,TS val 754710933 ecr 3858040], length 0
21:36:11.780490 IP prober3.event.dreamhack.se > tele.event.dreamhack.se: ICMP echo request, id 0, seq 0, length 28
21:36:11.780539 IP tele.event.dreamhack.se > prober3.event.dreamhack.se: ICMP echo reply, id 0, seq 0, length 28
21:36:12.494807 IP dhmon.event.dreamhack.se.45762 > tele.event.dreamhack.se.9100: Flags [S], seq 1902822197, win 29200, options [mss 1460,sackOK,TS val 74280929 ecr 0,nop,wscale 7], length 0
21:36:12.494877 IP tele.event.dreamhack.se.9100 > dhmon.event.dreamhack.se.45762: Flags [S.], seq 1457690463, ack 1902822198, win 28960, options [mss 1460,sackOK,TS val 3858276 ecr 74280929,nop,wscale 7], length 0
21:36:12.495049 IP dhmon.event.dreamhack.se.45762 > tele.event.dreamhack.se.9100: Flags [.], ack 1, win 229, options [nop,nop,TS val 74280929 ecr 3858276], length 0
21:36:12.495230 IP dhmon.event.dreamhack.se.45762 > tele.event.dreamhack.se.9100: Flags [P.], seq 1:350, ack 1, win 229, options [nop,nop,TS val 74280929 ecr 3858276], length 349
21:36:12.495247 IP tele.event.dreamhack.se.9100 > dhmon.event.dreamhack.se.45762: Flags [.], ack 350, win 235, options [nop,nop,TS val 3858276 ecr 74280929], length 0
21:36:12.503056 IP tele.event.dreamhack.se.9100 > dhmon.event.dreamhack.se.45762: Flags [P.], seq 1:4097, ack 350, win 235, options [nop,nop,TS val 3858278 ecr 74280929], length 4096
21:36:12.503126 IP tele.event.dreamhack.se.9100 > dhmon.event.dreamhack.se.45762: Flags [FP.], seq 4097:7012, ack 350, win 235, options [nop,nop,TS val 3858278 ecr 74280929], length 2915
21:36:12.503239 IP dhmon.event.dreamhack.se.45762 > tele.event.dreamhack.se.9100: Flags [.], ack 4097, win 293, options [nop,nop,TS val 74280931 ecr 3858278], length 0
21:36:12.503296 IP dhmon.event.dreamhack.se.45762 > tele.event.dreamhack.se.9100: Flags [.], ack 7013, win 338, options [nop,nop,TS val 74280931 ecr 3858278], length 0
21:36:12.506665 IP dhmon.event.dreamhack.se.45762 > tele.event.dreamhack.se.9100: Flags [F.], seq 350, ack 7013, win 338, options [nop,nop,TS val 74280932 ecr 3858278], length 0
21:36:12.506687 IP tele.event.dreamhack.se.9100 > dhmon.event.dreamhack.se.45762: Flags [.], ack 351, win 235, options [nop,nop,TS val 3858279 ecr 74280932], length 0
21:36:12.550750 IP tele.event.dreamhack.se.44228 > ddns1.event.dreamhack.se.domain: 19310+ PTR? 87.229.80.77.in-addr.arpa. (43)
21:36:12.551205 IP ddns1.event.dreamhack.se.domain > tele.event.dreamhack.se.44228: 19310* 1/2/4 PTR 77-80-229-87.event.dreamhack.se. (216)
21:36:12.551304 IP tele.event.dreamhack.se.37245 > ddns1.event.dreamhack.se.domain: 22473+ PTR? 181.231.80.77.in-addr.arpa. (44)
21:36:12.551677 IP ddns1.event.dreamhack.se.domain > tele.event.dreamhack.se.37245: 22473* 1/4/8 PTR tele.event.dreamhack.se. (344)
21:36:12.551814 IP tele.event.dreamhack.se.59896 > ddns1.event.dreamhack.se.domain: 55999+ PTR? 121.231.80.77.in-addr.arpa. (44)
21:36:12.552244 IP ddns1.event.dreamhack.se.domain > tele.event.dreamhack.se.59896: 55999* 1/4/8 PTR prober3.event.dreamhack.se. (347)
21:36:12.552339 IP tele.event.dreamhack.se.45701 > ddns1.event.dreamhack.se.domain: 37657+ PTR? 117.231.80.77.in-addr.arpa. (44)
21:36:12.552705 IP ddns1.event.dreamhack.se.domain > tele.event.dreamhack.se.45701: 37657* 1/4/8 PTR dhmon.event.dreamhack.se. (345)
21:36:12.788111 IP prober3.event.dreamhack.se > tele.event.dreamhack.se: ICMP echo request, id 0, seq 0, length 28
21:36:12.788190 IP tele.event.dreamhack.se > prober3.event.dreamhack.se: ICMP echo reply, id 0, seq 0, length 28
21:36:13.299378 IP 77-80-229-87.event.dreamhack.se.64339 > tele.event.dreamhack.se.https: Flags [F.], seq 2710221117, ack 3241074355, win 4096, options [nop,nop,TS val 754712679 ecr 3847976], length 0
21:36:13.299480 IP tele.event.dreamhack.se.https > 77-80-229-87.event.dreamhack.se.64339: Flags [R], seq 3241074355, win 0, length 0
21:36:13.299494 IP 77-80-229-87.event.dreamhack.se.64340 > tele.event.dreamhack.se.https: Flags [F.], seq 299886583, ack 1301192866, win 4096, options [nop,nop,TS val 754712679 ecr 3847976], length 0
21:36:13.299499 IP 77-80-229-87.event.dreamhack.se.64338 > tele.event.dreamhack.se.https: Flags [F.], seq 3415035124, ack 187118957, win 4096, options [nop,nop,TS val 754712679 ecr 3847976], length 0
21:36:13.299511 IP tele.event.dreamhack.se.https > 77-80-229-87.event.dreamhack.se.64338: Flags [R], seq 187118957, win 0, length 0
21:36:13.299514 IP 77-80-229-87.event.dreamhack.se.64329 > tele.event.dreamhack.se.https: Flags [F.], seq 2408309448, ack 1339896868, win 4096, options [nop,nop,TS val 754712679 ecr 3847976], length 0
21:36:13.299523 IP tele.event.dreamhack.se.https > 77-80-229-87.event.dreamhack.se.64340: Flags [R], seq 1301192866, win 0, length 0
21:36:13.299547 IP 77-80-229-87.event.dreamhack.se.64337 > tele.event.dreamhack.se.https: Flags [F.], seq 1311650860, ack 2012182664, win 4096, options [nop,nop,TS val 754712679 ecr 3847976], length 0
21:36:13.299552 IP tele.event.dreamhack.se.https > 77-80-229-87.event.dreamhack.se.64329: Flags [R], seq 1339896868, win 0, length 0
21:36:13.299563 IP tele.event.dreamhack.se.https > 77-80-229-87.event.dreamhack.se.64337: Flags [R], seq 2012182664, win 0, length 0
21:36:13.299738 IP 77-80-229-87.event.dreamhack.se.64509 > tele.event.dreamhack.se.https: Flags [S], seq 3992849116, win 65535, options [mss 1460,nop,wscale 5,nop,nop,TS val 754712679 ecr 0,sackOK,eol], length 0
21:36:13.299790 IP tele.event.dreamhack.se.https > 77-80-229-87.event.dreamhack.se.64509: Flags [S.], seq 3160414627, ack 3992849117, win 28960, options [mss 1460,sackOK,TS val 3858477 ecr 754712679,nop,wscale 7], length 0
21:36:13.300025 IP 77-80-229-87.event.dreamhack.se.64509 > tele.event.dreamhack.se.https: Flags [.], ack 1, win 4117, options [nop,nop,TS val 754712679 ecr 3858477], length 0
21:36:13.300204 IP 77-80-229-87.event.dreamhack.se.64509 > tele.event.dreamhack.se.https: Flags [P.], seq 1:518, ack 1, win 4117, options [nop,nop,TS val 754712679 ecr 3858477], length 517
21:36:13.300227 IP tele.event.dreamhack.se.https > 77-80-229-87.event.dreamhack.se.64509: Flags [.], ack 518, win 235, options [nop,nop,TS val 3858478 ecr 754712679], length 0
21:36:13.307167 IP tele.event.dreamhack.se.https > 77-80-229-87.event.dreamhack.se.64509: Flags [P.], seq 1:1748, ack 518, win 235, options [nop,nop,TS val 3858479 ecr 754712679], length 1747
21:36:13.307685 IP 77-80-229-87.event.dreamhack.se.64509 > tele.event.dreamhack.se.https: Flags [.], ack 1748, win 4063, options [nop,nop,TS val 754712687 ecr 3858479], length 0
21:36:13.308066 IP 77-80-229-87.event.dreamhack.se.64509 > tele.event.dreamhack.se.https: Flags [P.], seq 518:1157, ack 1748, win 4096, options [nop,nop,TS val 754712687 ecr 3858479], length 639
21:36:13.328852 IP tele.event.dreamhack.se.https > 77-80-229-87.event.dreamhack.se.64509: Flags [P.], seq 1748:1974, ack 1157, win 245, options [nop,nop,TS val 3858485 ecr 754712687], length 226
21:36:13.329288 IP 77-80-229-87.event.dreamhack.se.64509 > tele.event.dreamhack.se.https: Flags [.], ack 1974, win 4088, options [nop,nop,TS val 754712707 ecr 3858485], length 0
21:36:13.329695 IP 77-80-229-87.event.dreamhack.se.64509 > tele.event.dreamhack.se.https: Flags [F.], seq 1157, ack 1974, win 4096, options [nop,nop,TS val 754712707 ecr 3858485], length 0
21:36:13.330156 IP 77-80-229-87.event.dreamhack.se.64510 > tele.event.dreamhack.se.https: Flags [S], seq 3293793661, win 65535, options [mss 1460,nop,wscale 5,nop,nop,TS val 754712707 ecr 0,sackOK,eol], length 0
21:36:13.330186 IP tele.event.dreamhack.se.https > 77-80-229-87.event.dreamhack.se.64510: Flags [S.], seq 4084930356, ack 3293793662, win 28960, options [mss 1460,sackOK,TS val 3858485 ecr 754712707,nop,wscale 7], length 0
21:36:13.330518 IP 77-80-229-87.event.dreamhack.se.64510 > tele.event.dreamhack.se.https: Flags [.], ack 1, win 4117, options [nop,nop,TS val 754712708 ecr 3858485], length 0
21:36:13.330542 IP tele.event.dreamhack.se.https > 77-80-229-87.event.dreamhack.se.64509: Flags [F.], seq 1974, ack 1158, win 245, options [nop,nop,TS val 3858485 ecr 754712707], length 0
21:36:13.330766 IP 77-80-229-87.event.dreamhack.se.64510 > tele.event.dreamhack.se.https: Flags [P.], seq 1:518, ack 1, win 4117, options [nop,nop,TS val 754712708 ecr 3858485], length 517
21:36:13.330781 IP tele.event.dreamhack.se.https > 77-80-229-87.event.dreamhack.se.64510: Flags [.], ack 518, win 235, options [nop,nop,TS val 3858485 ecr 754712708], length 0
21:36:13.330904 IP 77-80-229-87.event.dreamhack.se.64509 > tele.event.dreamhack.se.https: Flags [.], ack 1975, win 4096, options [nop,nop,TS val 754712708 ecr 3858485], length 0
21:36:13.333696 IP tele.event.dreamhack.se.https > 77-80-229-87.event.dreamhack.se.64510: Flags [P.], seq 1:1748, ack 518, win 235, options [nop,nop,TS val 3858486 ecr 754712708], length 1747
21:36:13.334270 IP 77-80-229-87.event.dreamhack.se.64510 > tele.event.dreamhack.se.https: Flags [.], ack 1748, win 4063, options [nop,nop,TS val 754712711 ecr 3858486], length 0
21:36:13.334725 IP 77-80-229-87.event.dreamhack.se.64510 > tele.event.dreamhack.se.https: Flags [P.], seq 518:1157, ack 1748, win 4096, options [nop,nop,TS val 754712711 ecr 3858486], length 639
21:36:13.352374 IP tele.event.dreamhack.se.https > 77-80-229-87.event.dreamhack.se.64510: Flags [P.], seq 1748:1974, ack 1157, win 245, options [nop,nop,TS val 3858491 ecr 754712711], length 226
21:36:13.352815 IP 77-80-229-87.event.dreamhack.se.64510 > tele.event.dreamhack.se.https: Flags [.], ack 1974, win 4088, options [nop,nop,TS val 754712729 ecr 3858491], length 0
21:36:13.353701 IP 77-80-229-87.event.dreamhack.se.64510 > tele.event.dreamhack.se.https: Flags [P.], seq 1157:1602, ack 1974, win 4096, options [nop,nop,TS val 754712729 ecr 3858491], length 445
21:36:13.364207 IP tele.event.dreamhack.se.https > 77-80-229-87.event.dreamhack.se.64510: Flags [P.], seq 1974:2297, ack 1602, win 255, options [nop,nop,TS val 3858494 ecr 754712729], length 323
21:36:13.364301 IP tele.event.dreamhack.se.https > 77-80-229-87.event.dreamhack.se.64510: Flags [.], seq 2297:3745, ack 1602, win 255, options [nop,nop,TS val 3858494 ecr 754712729], length 1448
21:36:13.364524 IP 77-80-229-87.event.dreamhack.se.64510 > tele.event.dreamhack.se.https: Flags [.], ack 2297, win 4085, options [nop,nop,TS val 754712740 ecr 3858494], length 0
21:36:13.364540 IP tele.event.dreamhack.se.https > 77-80-229-87.event.dreamhack.se.64510: Flags [P.], seq 3745:4906, ack 1602, win 255, options [nop,nop,TS val 3858494 ecr 754712740], length 1161
21:36:13.364883 IP 77-80-229-87.event.dreamhack.se.64510 > tele.event.dreamhack.se.https: Flags [.], ack 4906, win 4014, options [nop,nop,TS val 754712740 ecr 3858494], length 0
21:36:13.504175 IP 77-80-229-87.event.dreamhack.se.64511 > tele.event.dreamhack.se.https: Flags [S], seq 36862840, win 65535, options [mss 1460,nop,wscale 5,nop,nop,TS val 754712878 ecr 0,sackOK,eol], length 0
21:36:13.504242 IP tele.event.dreamhack.se.https > 77-80-229-87.event.dreamhack.se.64511: Flags [S.], seq 3385644449, ack 36862841, win 28960, options [mss 1460,sackOK,TS val 3858529 ecr 754712878,nop,wscale 7], length 0
21:36:13.504255 IP 77-80-229-87.event.dreamhack.se.64512 > tele.event.dreamhack.se.https: Flags [S], seq 1238992648, win 65535, options [mss 1460,nop,wscale 5,nop,nop,TS val 754712879 ecr 0,sackOK,eol], length 0
21:36:13.504266 IP tele.event.dreamhack.se.https > 77-80-229-87.event.dreamhack.se.64512: Flags [S.], seq 1775793824, ack 1238992649, win 28960, options [mss 1460,sackOK,TS val 3858529 ecr 754712879,nop,wscale 7], length 0
21:36:13.504274 IP 77-80-229-87.event.dreamhack.se.64513 > tele.event.dreamhack.se.https: Flags [S], seq 3264004182, win 65535, options [mss 1460,nop,wscale 5,nop,nop,TS val 754712879 ecr 0,sackOK,eol], length 0
21:36:13.504284 IP tele.event.dreamhack.se.https > 77-80-229-87.event.dreamhack.se.64513: Flags [S.], seq 2878432165, ack 3264004183, win 28960, options [mss 1460,sackOK,TS val 3858529 ecr 754712879,nop,wscale 7], length 0
21:36:13.504354 IP 77-80-229-87.event.dreamhack.se.64514 > tele.event.dreamhack.se.https: Flags [S], seq 3652102835, win 65535, options [mss 1460,nop,wscale 5,nop,nop,TS val 754712879 ecr 0,sackOK,eol], length 0
21:36:13.504391 IP tele.event.dreamhack.se.https > 77-80-229-87.event.dreamhack.se.64514: Flags [S.], seq 458996639, ack 3652102836, win 28960, options [mss 1460,sackOK,TS val 3858529 ecr 754712879,nop,wscale 7], length 0
21:36:13.504413 IP 77-80-229-87.event.dreamhack.se.64515 > tele.event.dreamhack.se.https: Flags [S], seq 1031102323, win 65535, options [mss 1460,nop,wscale 5,nop,nop,TS val 754712879 ecr 0,sackOK,eol], length 0
21:36:13.504437 IP tele.event.dreamhack.se.https > 77-80-229-87.event.dreamhack.se.64515: Flags [S.], seq 1784044017, ack 1031102324, win 28960, options [mss 1460,sackOK,TS val 3858529 ecr 754712879,nop,wscale 7], length 0
21:36:13.504541 IP 77-80-229-87.event.dreamhack.se.64511 > tele.event.dreamhack.se.https: Flags [.], ack 1, win 4117, options [nop,nop,TS val 754712879 ecr 3858529], length 0
21:36:13.504567 IP 77-80-229-87.event.dreamhack.se.64512 > tele.event.dreamhack.se.https: Flags [.], ack 1, win 4117, options [nop,nop,TS val 754712879 ecr 3858529], length 0
21:36:13.504578 IP 77-80-229-87.event.dreamhack.se.64513 > tele.event.dreamhack.se.https: Flags [.], ack 1, win 4117, options [nop,nop,TS val 754712879 ecr 3858529], length 0
21:36:13.504605 IP 77-80-229-87.event.dreamhack.se.64514 > tele.event.dreamhack.se.https: Flags [.], ack 1, win 4117, options [nop,nop,TS val 754712879 ecr 3858529], length 0
21:36:13.504619 IP 77-80-229-87.event.dreamhack.se.64510 > tele.event.dreamhack.se.https: Flags [P.], seq 1602:2109, ack 4906, win 4096, options [nop,nop,TS val 754712879 ecr 3858494], length 507
21:36:13.504681 IP 77-80-229-87.event.dreamhack.se.64515 > tele.event.dreamhack.se.https: Flags [.], ack 1, win 4117, options [nop,nop,TS val 754712879 ecr 3858529], length 0
21:36:13.504733 IP 77-80-229-87.event.dreamhack.se.64511 > tele.event.dreamhack.se.https: Flags [P.], seq 1:518, ack 1, win 4117, options [nop,nop,TS val 754712879 ecr 3858529], length 517
21:36:13.504748 IP tele.event.dreamhack.se.https > 77-80-229-87.event.dreamhack.se.64511: Flags [.], ack 518, win 235, options [nop,nop,TS val 3858529 ecr 754712879], length 0
21:36:13.504791 IP 77-80-229-87.event.dreamhack.se.64512 > tele.event.dreamhack.se.https: Flags [P.], seq 1:518, ack 1, win 4117, options [nop,nop,TS val 754712879 ecr 3858529], length 517
21:36:13.504802 IP tele.event.dreamhack.se.https > 77-80-229-87.event.dreamhack.se.64512: Flags [.], ack 518, win 235, options [nop,nop,TS val 3858529 ecr 754712879], length 0
21:36:13.504858 IP 77-80-229-87.event.dreamhack.se.64513 > tele.event.dreamhack.se.https: Flags [P.], seq 1:518, ack 1, win 4117, options [nop,nop,TS val 754712879 ecr 3858529], length 517
21:36:13.504870 IP tele.event.dreamhack.se.https > 77-80-229-87.event.dreamhack.se.64513: Flags [.], ack 518, win 235, options [nop,nop,TS val 3858529 ecr 754712879], length 0
21:36:13.504926 IP 77-80-229-87.event.dreamhack.se.64514 > tele.event.dreamhack.se.https: Flags [P.], seq 1:518, ack 1, win 4117, options [nop,nop,TS val 754712879 ecr 3858529], length 517
21:36:13.504944 IP tele.event.dreamhack.se.https > 77-80-229-87.event.dreamhack.se.64514: Flags [.], ack 518, win 235, options [nop,nop,TS val 3858529 ecr 754712879], length 0
21:36:13.505054 IP 77-80-229-87.event.dreamhack.se.64515 > tele.event.dreamhack.se.https: Flags [P.], seq 1:518, ack 1, win 4117, options [nop,nop,TS val 754712879 ecr 3858529], length 517
21:36:13.505070 IP tele.event.dreamhack.se.https > 77-80-229-87.event.dreamhack.se.64515: Flags [.], ack 518, win 235, options [nop,nop,TS val 3858529 ecr 754712879], length 0
21:36:13.508785 IP tele.event.dreamhack.se.https > 77-80-229-87.event.dreamhack.se.64511: Flags [P.], seq 1:160, ack 518, win 235, options [nop,nop,TS val 3858530 ecr 754712879], length 159
21:36:13.509052 IP 77-80-229-87.event.dreamhack.se.64511 > tele.event.dreamhack.se.https: Flags [.], ack 160, win 4112, options [nop,nop,TS val 754712883 ecr 3858530], length 0
21:36:13.509185 IP 77-80-229-87.event.dreamhack.se.64511 > tele.event.dreamhack.se.https: Flags [P.], seq 518:634, ack 160, win 4112, options [nop,nop,TS val 754712883 ecr 3858530], length 116
21:36:13.509281 IP tele.event.dreamhack.se.https > 77-80-229-87.event.dreamhack.se.64512: Flags [P.], seq 1:160, ack 518, win 235, options [nop,nop,TS val 3858530 ecr 754712879], length 159
21:36:13.509456 IP 77-80-229-87.event.dreamhack.se.64511 > tele.event.dreamhack.se.https: Flags [F.], seq 634, ack 160, win 4112, options [nop,nop,TS val 754712883 ecr 3858530], length 0
21:36:13.509514 IP 77-80-229-87.event.dreamhack.se.64512 > tele.event.dreamhack.se.https: Flags [.], ack 160, win 4112, options [nop,nop,TS val 754712883 ecr 3858530], length 0
21:36:13.509579 IP 77-80-229-87.event.dreamhack.se.64516 > tele.event.dreamhack.se.https: Flags [S], seq 770079347, win 65535, options [mss 1460,nop,wscale 5,nop,nop,TS val 754712883 ecr 0,sackOK,eol], length 0
21:36:13.509600 IP tele.event.dreamhack.se.https > 77-80-229-87.event.dreamhack.se.64516: Flags [S.], seq 951369310, ack 770079348, win 28960, options [mss 1460,sackOK,TS val 3858530 ecr 754712883,nop,wscale 7], length 0
21:36:13.509708 IP 77-80-229-87.event.dreamhack.se.64512 > tele.event.dreamhack.se.https: Flags [P.], seq 518:634, ack 160, win 4112, options [nop,nop,TS val 754712883 ecr 3858530], length 116
21:36:13.509818 IP 77-80-229-87.event.dreamhack.se.64516 > tele.event.dreamhack.se.https: Flags [.], ack 1, win 4117, options [nop,nop,TS val 754712883 ecr 3858530], length 0
21:36:13.509879 IP 77-80-229-87.event.dreamhack.se.64512 > tele.event.dreamhack.se.https: Flags [F.], seq 634, ack 160, win 4112, options [nop,nop,TS val 754712883 ecr 3858530], length 0
21:36:13.509961 IP 77-80-229-87.event.dreamhack.se.64517 > tele.event.dreamhack.se.https: Flags [S], seq 3894593777, win 65535, options [mss 1460,nop,wscale 5,nop,nop,TS val 754712883 ecr 0,sackOK,eol], length 0
21:36:13.509983 IP tele.event.dreamhack.se.https > 77-80-229-87.event.dreamhack.se.64517: Flags [S.], seq 1564188449, ack 3894593778, win 28960, options [mss 1460,sackOK,TS val 3858530 ecr 754712883,nop,wscale 7], length 0
21:36:13.510149 IP 77-80-229-87.event.dreamhack.se.64516 > tele.event.dreamhack.se.https: Flags [P.], seq 1:518, ack 1, win 4117, options [nop,nop,TS val 754712884 ecr 3858530], length 517
21:36:13.510166 IP tele.event.dreamhack.se.https > 77-80-229-87.event.dreamhack.se.64516: Flags [.], ack 518, win 235, options [nop,nop,TS val 3858530 ecr 754712884], length 0
21:36:13.510212 IP 77-80-229-87.event.dreamhack.se.64517 > tele.event.dreamhack.se.https: Flags [.], ack 1, win 4117, options [nop,nop,TS val 754712884 ecr 3858530], length 0
21:36:13.510264 IP tele.event.dreamhack.se.https > 77-80-229-87.event.dreamhack.se.64513: Flags [P.], seq 1:160, ack 518, win 235, options [nop,nop,TS val 3858530 ecr 754712879], length 159
21:36:13.510418 IP 77-80-229-87.event.dreamhack.se.64517 > tele.event.dreamhack.se.https: Flags [P.], seq 1:518, ack 1, win 4117, options [nop,nop,TS val 754712884 ecr 3858530], length 517
21:36:13.510435 IP tele.event.dreamhack.se.https > 77-80-229-87.event.dreamhack.se.64517: Flags [.], ack 518, win 235, options [nop,nop,TS val 3858530 ecr 754712884], length 0
21:36:13.510480 IP 77-80-229-87.event.dreamhack.se.64513 > tele.event.dreamhack.se.https: Flags [.], ack 160, win 4112, options [nop,nop,TS val 754712884 ecr 3858530], length 0
21:36:13.510559 IP 77-80-229-87.event.dreamhack.se.64513 > tele.event.dreamhack.se.https: Flags [P.], seq 518:634, ack 160, win 4112, options [nop,nop,TS val 754712884 ecr 3858530], length 116
21:36:13.510763 IP 77-80-229-87.event.dreamhack.se.64513 > tele.event.dreamhack.se.https: Flags [F.], seq 634, ack 160, win 4112, options [nop,nop,TS val 754712884 ecr 3858530], length 0
21:36:13.510887 IP tele.event.dreamhack.se.https > 77-80-229-87.event.dreamhack.se.64514: Flags [P.], seq 1:160, ack 518, win 235, options [nop,nop,TS val 3858530 ecr 754712879], length 159
21:36:13.510907 IP 77-80-229-87.event.dreamhack.se.64518 > tele.event.dreamhack.se.https: Flags [S], seq 4257708073, win 65535, options [mss 1460,nop,wscale 5,nop,nop,TS val 754712884 ecr 0,sackOK,eol], length 0
21:36:13.510931 IP tele.event.dreamhack.se.https > 77-80-229-87.event.dreamhack.se.64518: Flags [S.], seq 3548305768, ack 4257708074, win 28960, options [mss 1460,sackOK,TS val 3858530 ecr 754712884,nop,wscale 7], length 0
21:36:13.511150 IP 77-80-229-87.event.dreamhack.se.64514 > tele.event.dreamhack.se.https: Flags [.], ack 160, win 4112, options [nop,nop,TS val 754712885 ecr 3858530], length 0
21:36:13.511216 IP 77-80-229-87.event.dreamhack.se.64518 > tele.event.dreamhack.se.https: Flags [.], ack 1, win 4117, options [nop,nop,TS val 754712885 ecr 3858530], length 0
21:36:13.511280 IP 77-80-229-87.event.dreamhack.se.64514 > tele.event.dreamhack.se.https: Flags [P.], seq 518:634, ack 160, win 4112, options [nop,nop,TS val 754712885 ecr 3858530], length 116
21:36:13.511575 IP 77-80-229-87.event.dreamhack.se.64514 > tele.event.dreamhack.se.https: Flags [F.], seq 634, ack 160, win 4112, options [nop,nop,TS val 754712885 ecr 3858530], length 0
21:36:13.511588 IP 77-80-229-87.event.dreamhack.se.64518 > tele.event.dreamhack.se.https: Flags [P.], seq 1:518, ack 1, win 4117, options [nop,nop,TS val 754712885 ecr 3858530], length 517
21:36:13.511596 IP tele.event.dreamhack.se.https > 77-80-229-87.event.dreamhack.se.64518: Flags [.], ack 518, win 235, options [nop,nop,TS val 3858530 ecr 754712885], length 0
21:36:13.511657 IP 77-80-229-87.event.dreamhack.se.64519 > tele.event.dreamhack.se.https: Flags [S], seq 712194173, win 65535, options [mss 1460,nop,wscale 5,nop,nop,TS val 754712885 ecr 0,sackOK,eol], length 0
21:36:13.511680 IP tele.event.dreamhack.se.https > 77-80-229-87.event.dreamhack.se.64519: Flags [S.], seq 3178329842, ack 712194174, win 28960, options [mss 1460,sackOK,TS val 3858530 ecr 754712885,nop,wscale 7], length 0
21:36:13.511791 IP tele.event.dreamhack.se.https > 77-80-229-87.event.dreamhack.se.64515: Flags [P.], seq 1:160, ack 518, win 235, options [nop,nop,TS val 3858530 ecr 754712879], length 159
21:36:13.511932 IP 77-80-229-87.event.dreamhack.se.64519 > tele.event.dreamhack.se.https: Flags [.], ack 1, win 4117, options [nop,nop,TS val 754712885 ecr 3858530], length 0
21:36:13.512060 IP 77-80-229-87.event.dreamhack.se.64515 > tele.event.dreamhack.se.https: Flags [.], ack 160, win 4112, options [nop,nop,TS val 754712885 ecr 3858530], length 0
21:36:13.512070 IP tele.event.dreamhack.se.55791 > ddns1.event.dreamhack.se.domain: 23069+ PTR? 201.231.80.77.in-addr.arpa. (44)
21:36:13.512071 IP 77-80-229-87.event.dreamhack.se.64519 > tele.event.dreamhack.se.https: Flags [P.], seq 1:518, ack 1, win 4117, options [nop,nop,TS val 754712885 ecr 3858530], length 517
21:36:13.512079 IP tele.event.dreamhack.se.https > 77-80-229-87.event.dreamhack.se.64519: Flags [.], ack 518, win 235, options [nop,nop,TS val 3858531 ecr 754712885], length 0
21:36:13.512120 IP 77-80-229-87.event.dreamhack.se.64515 > tele.event.dreamhack.se.https: Flags [P.], seq 518:634, ack 160, win 4112, options [nop,nop,TS val 754712885 ecr 3858530], length 116
21:36:13.512305 IP 77-80-229-87.event.dreamhack.se.64515 > tele.event.dreamhack.se.https: Flags [F.], seq 634, ack 160, win 4112, options [nop,nop,TS val 754712886 ecr 3858530], length 0
21:36:13.512404 IP 77-80-229-87.event.dreamhack.se.64520 > tele.event.dreamhack.se.https: Flags [S], seq 248899968, win 65535, options [mss 1460,nop,wscale 5,nop,nop,TS val 754712886 ecr 0,sackOK,eol], length 0
21:36:13.512426 IP tele.event.dreamhack.se.https > 77-80-229-87.event.dreamhack.se.64520: Flags [S.], seq 109052982, ack 248899969, win 28960, options [mss 1460,sackOK,TS val 3858531 ecr 754712886,nop,wscale 7], length 0
21:36:13.512575 IP ddns1.event.dreamhack.se.domain > tele.event.dreamhack.se.55791: 23069* 1/4/8 PTR ddns1.event.dreamhack.se. (345)
21:36:13.512656 IP 77-80-229-87.event.dreamhack.se.64520 > tele.event.dreamhack.se.https: Flags [.], ack 1, win 4117, options [nop,nop,TS val 754712886 ecr 3858531], length 0
21:36:13.512794 IP 77-80-229-87.event.dreamhack.se.64520 > tele.event.dreamhack.se.https: Flags [P.], seq 1:518, ack 1, win 4117, options [nop,nop,TS val 754712886 ecr 3858531], length 517
21:36:13.512807 IP tele.event.dreamhack.se.https > 77-80-229-87.event.dreamhack.se.64520: Flags [.], ack 518, win 235, options [nop,nop,TS val 3858531 ecr 754712886], length 0
21:36:13.516527 IP tele.event.dreamhack.se.https > 77-80-229-87.event.dreamhack.se.64511: Flags [F.], seq 160, ack 635, win 235, options [nop,nop,TS val 3858532 ecr 754712883], length 0
21:36:13.516858 IP 77-80-229-87.event.dreamhack.se.64511 > tele.event.dreamhack.se.https: Flags [.], ack 161, win 4112, options [nop,nop,TS val 754712889 ecr 3858532], length 0
21:36:13.517021 IP tele.event.dreamhack.se.https > 77-80-229-87.event.dreamhack.se.64512: Flags [F.], seq 160, ack 635, win 235, options [nop,nop,TS val 3858532 ecr 754712883], length 0
21:36:13.517253 IP 77-80-229-87.event.dreamhack.se.64512 > tele.event.dreamhack.se.https: Flags [.], ack 161, win 4112, options [nop,nop,TS val 754712889 ecr 3858532], length 0
21:36:13.517409 IP tele.event.dreamhack.se.https > 77-80-229-87.event.dreamhack.se.64513: Flags [F.], seq 160, ack 635, win 235, options [nop,nop,TS val 3858532 ecr 754712884], length 0
21:36:13.517605 IP tele.event.dreamhack.se.https > 77-80-229-87.event.dreamhack.se.64514: Flags [F.], seq 160, ack 635, win 235, options [nop,nop,TS val 3858532 ecr 754712885], length 0
21:36:13.517644 IP 77-80-229-87.event.dreamhack.se.64513 > tele.event.dreamhack.se.https: Flags [.], ack 161, win 4112, options [nop,nop,TS val 754712889 ecr 3858532], length 0
21:36:13.517845 IP tele.event.dreamhack.se.https > 77-80-229-87.event.dreamhack.se.64515: Flags [F.], seq 160, ack 635, win 235, options [nop,nop,TS val 3858532 ecr 754712885], length 0
21:36:13.517847 IP 77-80-229-87.event.dreamhack.se.64514 > tele.event.dreamhack.se.https: Flags [.], ack 161, win 4112, options [nop,nop,TS val 754712890 ecr 3858532], length 0
21:36:13.518079 IP 77-80-229-87.event.dreamhack.se.64515 > tele.event.dreamhack.se.https: Flags [.], ack 161, win 4112, options [nop,nop,TS val 754712890 ecr 3858532], length 0
21:36:13.520297 IP tele.event.dreamhack.se.https > 77-80-229-87.event.dreamhack.se.64510: Flags [P.], seq 4906:5179, ack 2109, win 265, options [nop,nop,TS val 3858533 ecr 754712879], length 273
21:36:13.520556 IP 77-80-229-87.event.dreamhack.se.64510 > tele.event.dreamhack.se.https: Flags [.], ack 5179, win 4087, options [nop,nop,TS val 754712892 ecr 3858533], length 0
21:36:13.520675 IP tele.event.dreamhack.se.https > 77-80-229-87.event.dreamhack.se.64516: Flags [P.], seq 1:160, ack 518, win 235, options [nop,nop,TS val 3858533 ecr 754712884], length 159
21:36:13.520913 IP 77-80-229-87.event.dreamhack.se.64516 > tele.event.dreamhack.se.https: Flags [.], ack 160, win 4112, options [nop,nop,TS val 754712892 ecr 3858533], length 0
21:36:13.521076 IP tele.event.dreamhack.se.https > 77-80-229-87.event.dreamhack.se.64517: Flags [P.], seq 1:160, ack 518, win 235, options [nop,nop,TS val 3858533 ecr 754712884], length 159
21:36:13.521305 IP 77-80-229-87.event.dreamhack.se.64517 > tele.event.dreamhack.se.https: Flags [.], ack 160, win 4112, options [nop,nop,TS val 754712892 ecr 3858533], length 0
21:36:13.521446 IP 77-80-229-87.event.dreamhack.se.64516 > tele.event.dreamhack.se.https: Flags [P.], seq 518:634, ack 160, win 4112, options [nop,nop,TS val 754712892 ecr 3858533], length 116
21:36:13.521494 IP tele.event.dreamhack.se.https > 77-80-229-87.event.dreamhack.se.64518: Flags [P.], seq 1:160, ack 518, win 235, options [nop,nop,TS val 3858533 ecr 754712885], length 159
21:36:13.521724 IP 77-80-229-87.event.dreamhack.se.64518 > tele.event.dreamhack.se.https: Flags [.], ack 160, win 4112, options [nop,nop,TS val 754712893 ecr 3858533], length 0
21:36:13.521786 IP 77-80-229-87.event.dreamhack.se.64517 > tele.event.dreamhack.se.https: Flags [P.], seq 518:634, ack 160, win 4112, options [nop,nop,TS val 754712893 ecr 3858533], length 116
21:36:13.522064 IP 77-80-229-87.event.dreamhack.se.64518 > tele.event.dreamhack.se.https: Flags [P.], seq 518:634, ack 160, win 4112, options [nop,nop,TS val 754712893 ecr 3858533], length 116
21:36:13.522339 IP tele.event.dreamhack.se.https > 77-80-229-87.event.dreamhack.se.64519: Flags [P.], seq 1:160, ack 518, win 235, options [nop,nop,TS val 3858533 ecr 754712885], length 159
21:36:13.522451 IP 77-80-229-87.event.dreamhack.se.64510 > tele.event.dreamhack.se.https: Flags [P.], seq 2109:2605, ack 5179, win 4096, options [nop,nop,TS val 754712893 ecr 3858533], length 496
21:36:13.522510 IP 77-80-229-87.event.dreamhack.se.64516 > tele.event.dreamhack.se.https: Flags [F.], seq 634, ack 160, win 4112, options [nop,nop,TS val 754712893 ecr 3858533], length 0
21:36:13.522577 IP 77-80-229-87.event.dreamhack.se.64519 > tele.event.dreamhack.se.https: Flags [.], ack 160, win 4112, options [nop,nop,TS val 754712893 ecr 3858533], length 0
21:36:13.522643 IP 77-80-229-87.event.dreamhack.se.64521 > tele.event.dreamhack.se.https: Flags [S], seq 4199339936, win 65535, options [mss 1460,nop,wscale 5,nop,nop,TS val 754712893 ecr 0,sackOK,eol], length 0
21:36:13.522667 IP tele.event.dreamhack.se.https > 77-80-229-87.event.dreamhack.se.64521: Flags [S.], seq 3069912655, ack 4199339937, win 28960, options [mss 1460,sackOK,TS val 3858533 ecr 754712893,nop,wscale 7], length 0
21:36:13.522770 IP 77-80-229-87.event.dreamhack.se.64519 > tele.event.dreamhack.se.https: Flags [P.], seq 518:634, ack 160, win 4112, options [nop,nop,TS val 754712894 ecr 3858533], length 116
21:36:13.522855 IP tele.event.dreamhack.se.https > 77-80-229-87.event.dreamhack.se.64520: Flags [P.], seq 1:160, ack 518, win 235, options [nop,nop,TS val 3858533 ecr 754712886], length 159
21:36:13.522892 IP 77-80-229-87.event.dreamhack.se.64521 > tele.event.dreamhack.se.https: Flags [.], ack 1, win 4117, options [nop,nop,TS val 754712894 ecr 3858533], length 0
21:36:13.522910 IP 77-80-229-87.event.dreamhack.se.64517 > tele.event.dreamhack.se.https: Flags [F.], seq 634, ack 160, win 4112, options [nop,nop,TS val 754712894 ecr 3858533], length 0
21:36:13.523013 IP 77-80-229-87.event.dreamhack.se.64522 > tele.event.dreamhack.se.https: Flags [S], seq 2751711601, win 65535, options [mss 1460,nop,wscale 5,nop,nop,TS val 754712894 ecr 0,sackOK,eol], length 0
21:36:13.523036 IP tele.event.dreamhack.se.https > 77-80-229-87.event.dreamhack.se.64522: Flags [S.], seq 2428155209, ack 2751711602, win 28960, options [mss 1460,sackOK,TS val 3858533 ecr 754712894,nop,wscale 7], length 0
21:36:13.523080 IP 77-80-229-87.event.dreamhack.se.64520 > tele.event.dreamhack.se.https: Flags [.], ack 160, win 4112, options [nop,nop,TS val 754712894 ecr 3858533], length 0
21:36:13.523200 IP 77-80-229-87.event.dreamhack.se.64518 > tele.event.dreamhack.se.https: Flags [P.], seq 634:1140, ack 160, win 4112, options [nop,nop,TS val 754712894 ecr 3858533], length 506
21:36:13.523218 IP tele.event.dreamhack.se.https > 77-80-229-87.event.dreamhack.se.64518: Flags [.], ack 1140, win 243, options [nop,nop,TS val 3858533 ecr 754712893], length 0
21:36:13.523272 IP 77-80-229-87.event.dreamhack.se.64522 > tele.event.dreamhack.se.https: Flags [.], ack 1, win 4117, options [nop,nop,TS val 754712894 ecr 3858533], length 0
21:36:13.523293 IP 77-80-229-87.event.dreamhack.se.64520 > tele.event.dreamhack.se.https: Flags [P.], seq 518:634, ack 160, win 4112, options [nop,nop,TS val 754712894 ecr 3858533], length 116
21:36:13.523667 IP 77-80-229-87.event.dreamhack.se.64521 > tele.event.dreamhack.se.https: Flags [P.], seq 1:518, ack 1, win 4117, options [nop,nop,TS val 754712894 ecr 3858533], length 517
21:36:13.523686 IP tele.event.dreamhack.se.https > 77-80-229-87.event.dreamhack.se.64521: Flags [.], ack 518, win 235, options [nop,nop,TS val 3858533 ecr 754712894], length 0
21:36:13.523795 IP 77-80-229-87.event.dreamhack.se.64522 > tele.event.dreamhack.se.https: Flags [P.], seq 1:518, ack 1, win 4117, options [nop,nop,TS val 754712894 ecr 3858533], length 517
21:36:13.523812 IP tele.event.dreamhack.se.https > 77-80-229-87.event.dreamhack.se.64522: Flags [.], ack 518, win 235, options [nop,nop,TS val 3858533 ecr 754712894], length 0
21:36:13.523865 IP 77-80-229-87.event.dreamhack.se.64519 > tele.event.dreamhack.se.https: Flags [P.], seq 634:1134, ack 160, win 4112, options [nop,nop,TS val 754712895 ecr 3858533], length 500
21:36:13.523882 IP tele.event.dreamhack.se.https > 77-80-229-87.event.dreamhack.se.64519: Flags [.], ack 1134, win 243, options [nop,nop,TS val 3858533 ecr 754712894], length 0
21:36:13.523987 IP 77-80-229-87.event.dreamhack.se.64520 > tele.event.dreamhack.se.https: Flags [P.], seq 634:1110, ack 160, win 4112, options [nop,nop,TS val 754712895 ecr 3858533], length 476
21:36:13.524007 IP tele.event.dreamhack.se.https > 77-80-229-87.event.dreamhack.se.64520: Flags [.], ack 1110, win 243, options [nop,nop,TS val 3858534 ecr 754712894], length 0
21:36:13.526104 IP tele.event.dreamhack.se.https > 77-80-229-87.event.dreamhack.se.64516: Flags [F.], seq 160, ack 635, win 235, options [nop,nop,TS val 3858534 ecr 754712892], length 0
21:36:13.526297 IP tele.event.dreamhack.se.https > 77-80-229-87.event.dreamhack.se.64517: Flags [F.], seq 160, ack 635, win 235, options [nop,nop,TS val 3858534 ecr 754712893], length 0
21:36:13.526403 IP 77-80-229-87.event.dreamhack.se.64516 > tele.event.dreamhack.se.https: Flags [.], ack 161, win 4112, options [nop,nop,TS val 754712897 ecr 3858534], length 0
21:36:13.526539 IP 77-80-229-87.event.dreamhack.se.64517 > tele.event.dreamhack.se.https: Flags [.], ack 161, win 4112, options [nop,nop,TS val 754712897 ecr 3858534], length 0
21:36:13.528378 IP tele.event.dreamhack.se.https > 77-80-229-87.event.dreamhack.se.64510: Flags [P.], seq 5179:5450, ack 2605, win 275, options [nop,nop,TS val 3858535 ecr 754712893], length 271
21:36:13.528633 IP 77-80-229-87.event.dreamhack.se.64510 > tele.event.dreamhack.se.https: Flags [.], ack 5450, win 4087, options [nop,nop,TS val 754712899 ecr 3858535], length 0
21:36:13.528807 IP tele.event.dreamhack.se.https > 77-80-229-87.event.dreamhack.se.64520: Flags [P.], seq 160:430, ack 1110, win 243, options [nop,nop,TS val 3858535 ecr 754712894], length 270
21:36:13.529054 IP 77-80-229-87.event.dreamhack.se.64520 > tele.event.dreamhack.se.https: Flags [.], ack 430, win 4104, options [nop,nop,TS val 754712899 ecr 3858535], length 0
21:36:13.529189 IP tele.event.dreamhack.se.https > 77-80-229-87.event.dreamhack.se.64521: Flags [P.], seq 1:160, ack 518, win 235, options [nop,nop,TS val 3858535 ecr 754712894], length 159
21:36:13.529444 IP 77-80-229-87.event.dreamhack.se.64521 > tele.event.dreamhack.se.https: Flags [.], ack 160, win 4112, options [nop,nop,TS val 754712899 ecr 3858535], length 0
21:36:13.529759 IP tele.event.dreamhack.se.https > 77-80-229-87.event.dreamhack.se.64522: Flags [P.], seq 1:160, ack 518, win 235, options [nop,nop,TS val 3858535 ecr 754712894], length 159
21:36:13.529773 IP 77-80-229-87.event.dreamhack.se.64521 > tele.event.dreamhack.se.https: Flags [P.], seq 518:634, ack 160, win 4112, options [nop,nop,TS val 754712900 ecr 3858535], length 116
21:36:13.529980 IP 77-80-229-87.event.dreamhack.se.64522 > tele.event.dreamhack.se.https: Flags [.], ack 160, win 4112, options [nop,nop,TS val 754712900 ecr 3858535], length 0
21:36:13.530050 IP 77-80-229-87.event.dreamhack.se.64522 > tele.event.dreamhack.se.https: Flags [P.], seq 518:634, ack 160, win 4112, options [nop,nop,TS val 754712900 ecr 3858535], length 116
21:36:13.530065 IP 77-80-229-87.event.dreamhack.se.64510 > tele.event.dreamhack.se.https: Flags [P.], seq 2605:3097, ack 5450, win 4096, options [nop,nop,TS val 754712900 ecr 3858535], length 492
21:36:13.530296 IP 77-80-229-87.event.dreamhack.se.64520 > tele.event.dreamhack.se.https: Flags [P.], seq 1110:1582, ack 430, win 4104, options [nop,nop,TS val 754712900 ecr 3858535], length 472
21:36:13.530310 IP 77-80-229-87.event.dreamhack.se.64521 > tele.event.dreamhack.se.https: Flags [F.], seq 634, ack 160, win 4112, options [nop,nop,TS val 754712900 ecr 3858535], length 0
21:36:13.530336 IP tele.event.dreamhack.se.https > 77-80-229-87.event.dreamhack.se.64518: Flags [P.], seq 160:432, ack 1140, win 243, options [nop,nop,TS val 3858535 ecr 754712893], length 272
21:36:13.530359 IP 77-80-229-87.event.dreamhack.se.64522 > tele.event.dreamhack.se.https: Flags [F.], seq 634, ack 160, win 4112, options [nop,nop,TS val 754712900 ecr 3858535], length 0
21:36:13.530518 IP 77-80-229-87.event.dreamhack.se.64523 > tele.event.dreamhack.se.https: Flags [S], seq 3146038180, win 65535, options [mss 1460,nop,wscale 5,nop,nop,TS val 754712900 ecr 0,sackOK,eol], length 0
21:36:13.530549 IP tele.event.dreamhack.se.https > 77-80-229-87.event.dreamhack.se.64523: Flags [S.], seq 3891343973, ack 3146038181, win 28960, options [mss 1460,sackOK,TS val 3858535 ecr 754712900,nop,wscale 7], length 0
21:36:13.530592 IP 77-80-229-87.event.dreamhack.se.64518 > tele.event.dreamhack.se.https: Flags [.], ack 432, win 4104, options [nop,nop,TS val 754712900 ecr 3858535], length 0
21:36:13.530607 IP 77-80-229-87.event.dreamhack.se.64524 > tele.event.dreamhack.se.https: Flags [S], seq 610287940, win 65535, options [mss 1460,nop,wscale 5,nop,nop,TS val 754712900 ecr 0,sackOK,eol], length 0
21:36:13.530623 IP tele.event.dreamhack.se.https > 77-80-229-87.event.dreamhack.se.64524: Flags [S.], seq 1291778727, ack 610287941, win 28960, options [mss 1460,sackOK,TS val 3858535 ecr 754712900,nop,wscale 7], length 0
21:36:13.530771 IP 77-80-229-87.event.dreamhack.se.64523 > tele.event.dreamhack.se.https: Flags [.], ack 1, win 4117, options [nop,nop,TS val 754712901 ecr 3858535], length 0
21:36:13.530772 IP tele.event.dreamhack.se.https > 77-80-229-87.event.dreamhack.se.64519: Flags [P.], seq 160:433, ack 1134, win 243, options [nop,nop,TS val 3858535 ecr 754712894], length 273
21:36:13.530840 IP 77-80-229-87.event.dreamhack.se.64524 > tele.event.dreamhack.se.https: Flags [.], ack 1, win 4117, options [nop,nop,TS val 754712901 ecr 3858535], length 0
